example_db=# \d my_contacts;
                      Table "public.my_contacts"
   Column   |          Type          | Collation | Nullable | Default
------------+------------------------+-----------+----------+---------
 first_name | character varying(50)  |           |          |
 last_name  | character varying(50)  |           |          |
 birthdate  | date                   |           |          |
 profession | character varying(60)  |           |          |
 interest   | character varying(100) |           |          |

------------------------------------------------------------------------------------------------------------------------------

=================================================== ALTER TABLE ====== ADD COLUMN ========================================
""" Qo'shimcha column qo'shdim va u column avtomatik to'ldiriladi va bir id ikkinchi marotaba takrorlanmaydi. """

example_db=# ALTER TABLE my_contacts ADD COLUMN id SERIAL PRIMARY KEY ;
ALTER TABLE

------------------------------------------------------------------------------------------------------------------------------

example_db=# \d my_contacts;
                                      Table "public.my_contacts"
   Column   |          Type          | Collation | Nullable |                 Default
------------+------------------------+-----------+----------+-----------------------------------------
 first_name | character varying(50)  |           |          |
 last_name  | character varying(50)  |           |          |
 birthdate  | date                   |           |          |
 profession | character varying(60)  |           |          |
 interest   | character varying(100) |           |          |
 id         | integer                |           | not null | nextval('my_contacts_id_seq'::regclass)
Indexes:
    "my_contacts_pkey" PRIMARY KEY, btree (id)

------------------------------------------------------------------------------------------------------------------------------
""" ID qo'shildi, endigi qiladigan ishimiz userlarni telefon raqamlari uchun ham column qo'shish. """

example_db=# SELECT * FROM my_contacts;
 first_name |  last_name   | birthdate  |    profession     |               interest                | id
------------+--------------+------------+-------------------+---------------------------------------+----
 Javohir    | Khamidullaev | 2002-02-22 | software engineer | music, tech, vlogging, draw a picture |  1
 Javohir    | Khamidullaev | 2002-02-22 | software engineer | learn new programming language        |  2
 Javohir    | Khamidullaev | 2002-02-22 | software engineer | learn new programming language        |  3
 Tom        | Cook         | 1960-03-04 | CEO               | technology                            |  4
 Tim        | Musk         | 1960-03-04 | CEO               | technology                            |  5
 Iskandar   | Taymatov     | 1994-08-09 | cook              | gardening                             |  6
 Jone       | Born         | 1993-01-10 | doctor            | lern new International languages      |  7
 Brod       | King         | 1993-01-10 | software engineer | foodball                              |  8
(8 rows)

""" Huddi shu buyrug'dan foydalanamiz faqat bu safar ma'lumot turini VARCHAR ga o'zgartiramiz. """
example_db=# ALTER TABLE my_contacts ADD COLUMN phone VARCHAR(50);
ALTER TABLE

------------------------------------------------------------------------------------------------------------------------------

example_db=# select * from my_contacts;
 first_name |  last_name   | birthdate  |    profession     |               interest                | id | phone
------------+--------------+------------+-------------------+---------------------------------------+----+-------
 Javohir    | Khamidullaev | 2002-02-22 | software engineer | music, tech, vlogging, draw a picture |  1 |
 Javohir    | Khamidullaev | 2002-02-22 | software engineer | learn new programming language        |  2 |
 Javohir    | Khamidullaev | 2002-02-22 | software engineer | learn new programming language        |  3 |
 Tom        | Cook         | 1960-03-04 | CEO               | technology                            |  4 |
 Tim        | Musk         | 1960-03-04 | CEO               | technology                            |  5 |
 Iskandar   | Taymatov     | 1994-08-09 | cook              | gardening                             |  6 |
 Jone       | Born         | 1993-01-10 | doctor            | lern new International languages      |  7 |
 Brod       | King         | 1993-01-10 | software engineer | foodball                              |  8 |
(8 rows)

------------------------------------------------------------------------------------------------------------------------------
""" UPDATE buyrug'i orqali WHERE kalit so'zini yozmasdan hamma qatorga bitta telefon raqamni qo'shib qo'ydim, albatta bu musol tariqasida. """

example_db=# UPDATE my_contacts SET phone = '+998999194422';
UPDATE 8

example_db=# select * from my_contacts;
 first_name |  last_name   | birthdate  |    profession     |               interest                | id |     phone
------------+--------------+------------+-------------------+---------------------------------------+----+---------------
 Javohir    | Khamidullaev | 2002-02-22 | software engineer | music, tech, vlogging, draw a picture |  1 | +998999194422
 Javohir    | Khamidullaev | 2002-02-22 | software engineer | learn new programming language        |  2 | +998999194422
 Javohir    | Khamidullaev | 2002-02-22 | software engineer | learn new programming language        |  3 | +998999194422
 Tom        | Cook         | 1960-03-04 | CEO               | technology                            |  4 | +998999194422
 Tim        | Musk         | 1960-03-04 | CEO               | technology                            |  5 | +998999194422
 Iskandar   | Taymatov     | 1994-08-09 | cook              | gardening                             |  6 | +998999194422
 Jone       | Born         | 1993-01-10 | doctor            | lern new International languages      |  7 | +998999194422
 Brod       | King         | 1993-01-10 | software engineer | foodball                              |  8 | +998999194422
(8 rows)

------------------------------------------------------------------------------------------------------------------------------
=================================================== ALTER TABLE ====== RENAME TO ========================================
"""
Agar table nomidan qoniqmasak uni ham ALTER TABLE orqali o'zgartirishimiz mumkin bo'ladi. Faqat bu safar ADD COLUMN o'rniga RENAME TO ishlatishimiz kerak bo'ladi.
"""

example_db=# ALTER TABLE my_contacts RENAME TO contacts;
ALTER TABLE


example_db=# \d
                    List of relations
 Schema |           Name           |   Type   |  Owner
--------+--------------------------+----------+----------
 public | contacts                 | table    | postgres
 public | doughnut_list            | table    | postgres
 public | example_table            | table    | postgres
 public | my_contacts_id_seq       | sequence | postgres
 public | my_contacts_two          | table    | postgres
 public | order_three              | table    | postgres
 public | order_three_order_id_seq | sequence | postgres
 public | orders                   | table    | postgres
 public | orders_two               | table    | postgres
(9 rows)

------------------------------------------------------------------------------------------------------------------------------
=================================================== ALTER TABLE ====== RENAME === TO ========================================

""" Endi bizga column nomi ham o'zgartirish kerak bo'lib qoldi, bu paytda ham ALTER TABLE-ni ishlatamiz. """
example_db=# select * from contacts;
 first_name |  last_name   | birthdate  |    profession     |               interest                | id |     phone
------------+--------------+------------+-------------------+---------------------------------------+----+---------------
 Javohir    | Khamidullaev | 2002-02-22 | software engineer | music, tech, vlogging, draw a picture |  1 | +998999194422
 Javohir    | Khamidullaev | 2002-02-22 | software engineer | learn new programming language        |  2 | +998999194422
 Javohir    | Khamidullaev | 2002-02-22 | software engineer | learn new programming language        |  3 | +998999194422
 Tom        | Cook         | 1960-03-04 | CEO               | technology                            |  4 | +998999194422
 Tim        | Musk         | 1960-03-04 | CEO               | technology                            |  5 | +998999194422
 Iskandar   | Taymatov     | 1994-08-09 | cook              | gardening                             |  6 | +998999194422
 Jone       | Born         | 1993-01-10 | doctor            | lern new International languages      |  7 | +998999194422
 Brod       | King         | 1993-01-10 | software engineer | foodball                              |  8 | +998999194422
(8 rows)

------------------------------------------------------------------------------------------------------------------------------
""" Quyidagi kod column nomini o'zgartirishga hizmat qiladi. """
example_db=# ALTER TABLE contacts RENAME phone TO phone_number;
ALTER TABLE

------------------------------------------------------------------------------------------------------------------------------

example_db=# select * from contacts;
 first_name |  last_name   | birthdate  |    profession     |               interest                | id | phone_number
------------+--------------+------------+-------------------+---------------------------------------+----+---------------
 Javohir    | Khamidullaev | 2002-02-22 | software engineer | music, tech, vlogging, draw a picture |  1 | +998999194422
 Javohir    | Khamidullaev | 2002-02-22 | software engineer | learn new programming language        |  2 | +998999194422
 Javohir    | Khamidullaev | 2002-02-22 | software engineer | learn new programming language        |  3 | +998999194422
 Tom        | Cook         | 1960-03-04 | CEO               | technology                            |  4 | +998999194422
 Tim        | Musk         | 1960-03-04 | CEO               | technology                            |  5 | +998999194422
 Iskandar   | Taymatov     | 1994-08-09 | cook              | gardening                             |  6 | +998999194422
 Jone       | Born         | 1993-01-10 | doctor            | lern new International languages      |  7 | +998999194422
 Brod       | King         | 1993-01-10 | software engineer | foodball                              |  8 | +998999194422
(8 rows)

------------------------------------------------------------------------------------------------------------------------------
=================================================== ALTER TABLE ====== ALTER COLUMN ========================================
""" Ma'lum bir column-ning type-ini o'zgartirmoqchi bo'lsan quyidagicha yo'l tutishimiz kerak bo'lar ekan. """
` Endi phone_number-ning type VARCHAR(60) ga teng. `

example_db=# ALTER TABLE contacts ALTER COLUMN phone_number TYPE VARCHAR(60);
ALTER TABLE

------------------------------------------------------------------------------------------------------------------------------

""" Endi bizning vazifamiz phone_number-ni Nullable degan joyiga ` not null ` deb kiritib qo'yish. """

example_db=# \d contacts;
                                        Table "public.contacts"
    Column    |          Type          | Collation | Nullable |                 Default
--------------+------------------------+-----------+----------+-----------------------------------------
 first_name   | character varying(50)  |           |          |
 last_name    | character varying(50)  |           |          |
 birthdate    | date                   |           |          |
 profession   | character varying(60)  |           |          |
 interest     | character varying(100) |           |          |
 id           | integer                |           | not null | nextval('my_contacts_id_seq'::regclass)
 phone_number | character varying(60)  |           |          |
Indexes:
    "my_contacts_pkey" PRIMARY KEY, btree (id)

------------------------------------------------------------------------------------------------------------------------------
=================================================== ALTER TABLE ====== ALTER COLUMN =========== SET NOT NULL ========================
""" Berilgan vazifani quyidagicha uslubda amalga oshirishimiz mumkin. """

example_db=# ALTER TABLE contacts ALTER COLUMN phone_number SET NOT NULL;
ALTER TABLE

------------------------------------------------------------------------------------------------------------------------------
` Natijani quyida ko'rishingiz mumkin. `

example_db=# \d contacts;
                                        Table "public.contacts"
    Column    |          Type          | Collation | Nullable |                 Default
--------------+------------------------+-----------+----------+-----------------------------------------
 first_name   | character varying(50)  |           |          |
 last_name    | character varying(50)  |           |          |
 birthdate    | date                   |           |          |
 profession   | character varying(60)  |           |          |
 interest     | character varying(100) |           |          |
 id           | integer                |           | not null | nextval('my_contacts_id_seq'::regclass)
 phone_number | character varying(60)  |           | not null |
Indexes:
    "my_contacts_pkey" PRIMARY KEY, btree (id)

------------------------------------------------------------------------------------------------------------------------------
=================================================== ALTER TABLE ====== DROP COLUMN ===================================
""" Endi kerakmas column-larni o'chiramiz. Buning uchun yana ALTER TABLE buyrug'idan foydalansak bo'ladi. """

example_db=# ALTER TABLE contacts DROP COLUMN nickname;
ALTER TABLE


